{
  "schema_version": 2,
  "id": "demo-expression-template",
  "display_name": "自定义角色表情模板",
  "renderer": "live2d_mocari",
  "entry": "model/model.model3.json",
  "interaction": {
    "head": [
      [
        0.3,
        0.1
      ],
      [
        0.7,
        0.1
      ],
      [
        0.7,
        0.45
      ],
      [
        0.3,
        0.45
      ]
    ],
    "body": [
      [
        0.35,
        0.45
      ],
      [
        0.65,
        0.45
      ],
      [
        0.65,
        0.9
      ],
      [
        0.35,
        0.9
      ]
    ],
    "anchor": [
      0.5,
      0.96
    ],
    "window_perch_y": 0.5
  },
  "actions": {
    "head_pat": null,
    "body_tap": null,
    "feed": null,
    "play": null,
    "rest": null,
    "greet": null,
    "peek": null,
    "invite": null
  },
  "parameter_map": {},
  "license": {
    "status": "unverified",
    "redistributable": false
  },
  "expression_profile": {
    "catalog": {
      "neutral": {
        "path": "model/neutral.exp3.json",
        "label": "中性"
      },
      "happy": {
        "path": "model/happy.exp3.json",
        "label": "开心"
      }
    },
    "baseline": {
      "neutral": "neutral",
      "cheerful": "happy"
    },
    "reactions": {
      "head_pat": [
        {
          "expression": "happy",
          "duration_ms": 1200
        }
      ]
    }
  }
}
